File-ID,Transcribed Text
1172912,"Tagad dažas rindiņas par savu māti. Māti vienmēr atcerēšos kā labu mīļu cilvēku, kas ar mums bērniem nekad nebārās un mūs nepēra un neplēsa aiz matiem vaj citādi nepārmācīja. Viņa noraudājās ja mēs kādu reizi neklausījām, tad jau mēs arī centāmies viņu nesāpināt un paklausīt. Tēvs bieži pārbraucot piedzēris mājās, dzērumā viņa to nekad nebāra, otrā rītā tik saudzīgos vārdos aizrādīja par dzeršanu un naudas iztērēšanu. Tāpat ar gājējiem vaj svešiem cilvēkiem nekad nebārās. Viņa bij stipri ticīga sieviete, lai gan svētulību ārēji neizrādīja. Jaunībā bijusi liela dziedātāja. Atminos, ka tēvs priekš 1905. gada svētdienas rītos turēja lūgšanas – visi mājas ļaudis kopā nodziedāja pāri dziesmas un nolasīja no sprediķu grāmatas tās dienas sprediķi. Uz baznīcu gan diezgan reti brauca. Pēc 1905. gada šo svētdienas svētbrīdi vairs neturēja un arī uz baznīcu tēvs vairs nebrauca. Viņš sirdījās uz toreizējo Umurgas draudzes mācītāju vācieti Hiršleidtu, kas nemieriem sākoties bij atstājis draudzi un aizbēdzis projām. Tēva mēdza teikt, ""kas tas par ganu, kas grūtā brīdī atstāj savu ganāmpulku un laižas lapās, tas ir derēts gans, ne īsts gans, tas mums nevar nekādu ceļu rādīt uz debesīm"". Mēs bijām pavisam 7 bērni no kuriem 3 nomira bērnībā –
 Emīls nomira 9 mēnešu vecumā, Viktors 3 mēnešus vecs un meitiņa Milda nomira 3 gadus veca. Es vēl atceros viņa savārgusi un teica mātei: ""Mammīņ, es miršu nost,"" un tiešām pēc pāris dienām viņa nomira. Toreiz jau pie ārstiem nebrauca, deva šādas tādas pašu lasītas tējas vaj kādus pilienus. Runāja tā, kam lemts mirt, tas nomirs un zāles nelīdzēs."
1172918,"ložmetēju rotā. Bij jāmācās izjaukt, salikt, nosaukt ložmetēju daļas, jāiet uz ierindas mācībām. Zaldātam jau mieru nedod. Mūsu bataljona komandieris pulkvedis Kalniņš bij laikam visstingrākais no visiem latviešu pulka komandieriem, viņš nelika kareivjiem mieru, dzina mācībās, bieži sapulcēja visu pulku kopā un tad pūta kā kareivji teica ""Курземский дух"". No 5.–
26. augustam pulks stāvēja pozīcijā ""Nāves salā"". No ložmetējiem stāvēja pozīcijās četri, pārējie bij rezerve. Es dabūju nodzīvot ""Nāves salas"" pozīcijās 10 dienas. Toreiz tur bij diezgan mierīgi, tik pa reizei vācieši izlaida pa mīnai vaj lielgabala granātai, nepagāja gan nevienas dienas kad kāds kareivis nebūtu kritis vaj ticis ievainots. Vāciešu pozīcijas atradās ļoti tuvu, pa šaujamlūkām ilgi nedrīkstēja skatīties, varēja drīz dabūt lodi pierē. Pa naktīm nedrīkstēja gulēt, vienmēr bij jābūt kaujas gatavībā. Pāri Daugavai bij uzcelts šaurs kājinieku tilts uz pontoniem, pa kuru naktīs notika apgāde un satiksme ar aizmuguri. 26. augustā krievi mūs nomainīja un pārgājām savās agrākās mītnēs. Tur izbūvējām zemnīcas un zirgiem staļļus, gatavojamies ziemai, bet 12. (25.) septembrī pienāca pavēle pārcelties uz Rīgu –
 uz Mīlgrāvi. Tur pulks apmetās Ziemeļblāzmā. Mūsu ložmetēju komanda novietojās Mangaļu pagasta namā uz paša Daugavas krasta. Šajā namā bij centrāla apkure un dzīve bij laba. Visa komanda novietojās vienā lielā zālē. Sākas atkal mācības un ložmetēju šaušanas apmācības un manevri pa jūrmalas kāpām –
 ar vārdu sakot sagatavošanās nākošām kaujām. ""Ziemeļblāzmā"" tika bieži rīkotas teātra izrādes, koncerti un ballītes, īsi sakot"
1172917,"Jurjevā dzīvojām miera laiku, Krasnojarskas pulka kazarmās. Tur bij daudz vienstāva ēku, kazarmas un saimniecības ēkas, kurām un plašam laukumam apkārt bij augsta sēta ar vārtiem, pie kuriem stāvēja sargi, tā ka bez atļaujas uz pilsētu nevarēja tikt. Mani iedalīja 4. rotā 2. vada 1. nodaļā. Agrākais rotas sastāvs neilgi pirms mūsu atbraukšanas bij aizsūtīts uz pozīcijām un pagāja labs laiks kamēr rota salasījās pilna. Vakaros uz ""poverku"" še dziedāja ""Dievs Kungs ir mūsu stiprā pils"", ""Dievs svētī ķeizaru"" un ""Dievs svētī Latviju"", kā arī noskaita tēvreizi. Disciplīna šeit bija stiprāka kā krievos, tik daudz gan nelamājās, bet uzliktos sodus arī bij jāpilda. Šeit es arī vienīgo reizi dabūju nostāvēt zem plints 2 stundas. Man iedeva stipri sarūsējušu plinti, es to diezgan pavirši notīrīju un par to man uzlika sodu ""два часа под винтовку"". Nebij jau viegli nostāvēt nekustoties ar flinti uz pleca, bet pēc tam gan zināju ar visādiem līdzekļiem padarīt flinti spožu. Šeit man iznāca vienīgā reize būt slimam un iet pie ārsta. Stāvot sardzē laukā pie malkas lietainā un vējainā laikā saaukstējos, man pietūka kakls un vaigi un nācās 10 dienas pavadīt vietējā ambulancē okolodkā. Vairāk par visu dienesta laiku pie ārsta netiku bijis. 16. jūlijā mūs, kādas 5 rotas, izsūtīja no Jurjevas uz Rīgu. Tur komandatūra mūsu rotu iedalīja 3. Kurzemes latviešu strēlnieku bataljonā, kas stāvēja kādas 20 verstis no Rīgas pie Daugavas pretim ""Nāves salai"". 19. jūlijā pēc jaunā stila 1. augustā mēs tur ieradāmies. Rota tika izdalīta pa visu pulku. Es pieteicos un tiku kopā ar vairākiem biedriem"
1172903,Ziņas par mūsu dzimtu.
1172905,"""Muižperi"" – tā agrāk saukušās šās mājas. Ļaudis uz tagadējo ""Āžkalnu"" māju vietu un ""Inku"" ļaudis uz tagadējiem Jaunķēņiem. Mans vectēvs gan sūdzējis Rīgā un Pēterburgā gribēdams dabūt mājas atpakaļ, bet neko nepanācis. Muižas īpašnieks nomiris bez tuvākiem mantiniekiem un Vainižu muiža pārgājusi valsts īpašumā kā ""kroņa"" muiža. Jaunajā vietā no sākuma mājas sauktas vecajā vārdā, bet vēlāk pārdēvētas par ""Āžkalniem"". Tur bijis liels kalns no kura pagastu ļaudis veduši granti ceļu labošanai. Pa šo kalnu ganījušies un lēkājuši vectēva āži un kazas un no tā arī mājas iesauktas par Āžkalniem. Kā cēlie mūsu dzimtas uzvārds Golvers? Mans brālis Ernests domā ka tas atvasināts no vācu vārda ""Goldvekr"", es domāju, ka tas cēlies no vārda ""galva"" vaj ""golva"". Vectēvs un viņa tēvs bijis ilgus gadus par pagasta vecāko un tad uzvārdu došanas laikā pieņemts uzvārds ""Galvers"" jeb ""Golvers"". Mans vectēvs Klāvs bijis enerģisks vīrs, kas nevarējis ar muižu sadzīvot. Viņš kopā ar vairākiem citiem Valmieras apriņķa pagastu vecākiem braucis uz Pēterburgu iesniegt ķeizaram sūdzību par nekārtību un nelikumībām no muižnieku puses. Šis pagastu vecāko brauciens taisnību meklēt ir aprakstīts Augusta Deglava romānā ""Rīga"". Tur vectēvs attēlots kā ar lielu, biezu, mēlnu bārdu un matiem apaudzis enerģisks zemnieks, kas kvēli sūdzējies par netaisnību. Ziemas laikā atpakaļ no Pēterburgas braucot vectēvs stipri saaukstējies dabūjis plaušu karsoni un nomiris laikam 1872. gadā ap 45 gadus vecs. Uz viņa"
1172911,"palika 3 meitas un dēls Voldemārs, kurš krita pasaules karā kaut kur pie Ķekavas 1916. gadā kādā krievu pulkā. Vecākā meita Alma izprecēta Ozolniekos (bijušā Āžu krogā); viņai 3 dēli, no kuriem vecākais Alberts tagad saimnieko Ozolniekos, viņam ir liels pulks bērnu. Abi pārējie dēlis Pēteris un Arnolds laikam juku laikos dabūjuši galu. Meita Irma bij precējusies ar Kaužu saimnieku Richardu Krišmani, bet drīz nomira un Kauža apprecēja citu. Meita Elza bij precējusies ar Jāni Zvīguli, Umugras biedrības līdzdarbinieku un vēlāk pagasta vecāko. Viņiem bij divi dēli, pa kara laiku viņi aizbēguši un neko tuvāku par viņiem nezinu. Mātes māsa Matilda bij precējusies ar kādu skolotāju, dzīvoja pa Kuldīgu neko tuvāk par viņiem nezinu. Mātes māsa Alvīne bija precējusies ar kādu Plēsumu, dzīvoja pa Rīgu, bij 4 dēli Jānis, Kārlis, Arturs un Ernests un meita Emma. Jānim Plācī bij kalēju darbnīca, Arturs pēc 1905. gada bija aizlaidies uz Ameriku un tur ticis pie dolariem, Ernests bij beidzis jūrskolu. Mātes māsa Anna nomira neprecēta. Mātes māsa Emma bij precējusies ar Rozules ""Šmits"" māju saimnieku Ernestu Freimani, bij divi dēli un divas meitas, viens dēls bij par mācītāju Mālīšu draudzē. Mātes brālis Voldemārs bij ilgus gadus par rakstvedis Rozules pagastā, iepirka ""Klāmaņu"" mājas un tad darbojās kā biedrības grāmatvedis-darbvedis. Plācī apprecēja Straupes skolotāju meitu Paegli. Bij dēls un meita. Viņš bij nopircis vairākas mājas pie izdevības par lētu maksu un tad atkal ar peļņu pārdeva. Dēlam bij nopirkts Veļķa muižas centrs Vaidavas pagastā, un tas tur saimniekoja."
1172913,"Toreiz jau arī ārstu bija maz. Limbažos bij viens vaj divi un tie paši neko daudz nezināja un zemnieki pie viņiem maz brauca. Vairāk gāja pie šādiem tādiem kaktu ārstiem, večiem vaj vecenēm. Domāju ka mātei bij labas vecumdienas, dēliem klājas labi, nekāda trūkuma nebij, dabūja izauklēties dēlu bērnus. Bieži vien viņa atnāca pie mums uz Mazlejām mūs apraudzīt un šo to palīdzēt. Māte nomira ar vēzi 1942. gada 25. jūnijā, jūlijā viņu paglabājām Umurgas kapos blakus savam vīram mūsu tēvam. Labi, ka viņa vairs neredzēja nākošās boļševiku varas laikus, kad dēliem bija jābēguļo un dzimtas mājas tika izputinātas un dēlu ģimenes aizvestas uz Sibīriju. Tagad lūkošu pastāstīt kaut ko par sevi. Esmu dzimi 1894. gada 26. oktobrī kā savu vecāku pirmais bērns. Drusku atceros sava tēva māti kā niknu sievieti, kurai vedekla – mana māte nekādi nevarēja izdarīt pa prātam. Māte staigāja noraudājusies un nobēdājusies. Šis mātes skumīgais gara stāvoklis ir atstājis iespaidu arī uz mani un padarījis manu raksturu par kautrīgu un klusu kas atraujas no sabiedrības. Neprotu būt sabiedrībā jautrs un īstu draugu nav bijis. Lasīt un rakstīt iemācījos ļoti agri piecu sešu gadu vecumā. Toreiz priekš 1900. gada bija angļu-būru karš Dienvidāfrikā, tēvs pastāvīgi abonēja laikrakstu un vakaros to lasīja mājiniekiem priekšā. Avīzē bieži bij interesanti apraksti par būru varoņdarbiem, ka"
1172915,"Skolā pie kopgalda nepiedalījos, ēdu no līdzdotās maizes un pavalga, noskatoties kā citi garšīgi paēd pusdienas. Viss lielais vairums skolēnu pie kopgalda nepiedalījās. Trūcīgi ēdot un dzīvojot pa iekšu lasīdams grāmatas atpaliku augšanā un paliku nespēcīgs. Reiz Lieldienu brīvlaikā tēvs mani sūtīja kopā ar kalpa Lapiņa dēlu Jāni uz mežu malku zāģēt. Pirmo dienu sazāģējām maz, bet otru dienu bij vēss miglains laiks, lai nesaltu tad rāvām dūšīgi, vakarā tikko jaudājām mājās pāriet. Es biju tā pārmocījies ka man tik ļoti trīcēja rokas, ka vairs nevarēju pogas aiztaisīt un pat lāga parunāt nevarēju. To pavasari vairs skolā nevarēju iet. Pa vasaru gan izveseļojos, tomēr tas atstāja sliktu iespaidu, no tā laika man reizēm raustās valoda. Pat vēl vecumā ārsts Kārkliņš mani izmeklējot prasīja vaj neesot slimojis ar bērnu trieku, esot tādas pazīmes. Skolu pabeidzu 1911. gada maija mēnesī. Visās mācībās man bij 5, tik dziedāšanā ielika 3. Izsniedza arī uzslavas rakstu. Priekš manis tāds bij piešķirts tik diviem – K. Klīģeram un P. Strazdiņam. Drīzi pēc skolas beigšanas, lāga neatceros, 1912. vaj 1913. gada pavasarī izgāju iesvētīšanas mācību. Divu nedēļu laikā bij dūšīgi jāmācās katķisms un bībelstāsti un mācītāja Hiršleidta lekcijas par ticības jautājumiem. Mēs, vairāki iesvētamie gulējām Umurgas biedrības garderobes telpās, jo izstaigāt līdz mājām nebij iespējams. Iesvētīšana notika Pūpolu svētdienā, cik atceros laiks toreiz bij silts un jauks. Nekādas svinības uz iesvētīšanu man nerīkoja. Strādāju pie tēva saimniecībā visus darbus līdz iesaukšanai kara dienestā. 1914. gada augustā iesākās pirmais pasaules karš. 1915. gada janvārī man bija jāierodas uz iesaukšanu kara dienestā pie komisijas"
1172908,"Liepājā kalpojot bij dabūjis venērisko slimību, kas neatturīgi dzīvojot vienmēr progresēja un nevarēdams sāpes izciest viņš 1923. gada 28. februārī nošāvās. Meita Zelma dzimusi 1893. gadā, apprecēja kādu rīdzinieku Brēdi, ar kuru dažus gadus kopā sadzīvojuši izšķīrās. No šīs laulības palika viens dēls, kurš 1944. gadā krita kaujās latviešu leģionā vācu pusē. Viņš bij arī precējies un paliks viens puisēns, ko Zelma tagad audzina. Zelma otrreiz apprecējās ar manu bijušo kara biedri Jāni Virsi no Vitrupes, viņš stipri rausta valodu. Viņiem ir dēls Kārlis kurš ir tāds garā vājš. Meita Melānija apprecējās ar Eduardu Antonko no Stalbes. Bij divi dēli. Vecākais Žanis krita kaujās Sarkanā Armijā 1945. gadā. Otrs dēls Elmārs apprecējis Hildu Kārkliņu, viņiem ir dēls Ēvalds dz. 1955. Tēva jaunākā māsa Kristīne bij precējusies ar kādu rentnieku Mārtiņu Cauci. Tas bija drukns vīrs ar melnu bārdu. Dažus gadus viņi dzīvoja kā rentnieki Āžkalnos, pēc tam dažādās mājās tuvākā apkārtnē. Caucis mira gadā Kārkliņu mājās. Viņiem bij 4 meitas un 1 dēls. Dēliņš jau maziņš sadega ugunsgrēkā kādā būdelē netāļ no Umurgas pagasta centra. Vecākā meita Vera precējusies ar Vidrižu jaunsaimnieku Gulbi, otra meita Vilma palika neprecēta, trešā meita Milda precējusies ar Kalnmuižas jaunsaimnieku Kalsonu. Ir 2 dēli un 2 meitas. Jaunākā meita Zelma precējusies ar amatnieku Jāni Vankeru un agri palika atraitne. Viņai ir vairāki bērni, bet cik īsti, to nezinu. Tā nu esmu par tava tēva brāļiem un māsām šo to uzrakstījis un nu mēģināšu pastāstīt par savu tēvu"
1172904,"Jānis Andreja d. Golvers 1956. g. 
Ziņas par mūsu dzimtu.
Gribu šeit uzrakstīt dažas ziņas par mūsu – Golveru dzimtu. Ceru ka maniem bērniem būs interesanti palasīt par savas dzimtas tēviem un vectēviem. Man tagad žēl ka es neizvaicāju savu tēvu par viņa tēva un vectēva dzīvi un darbību. Ar man daudz kas palicis nezināms. Agrāk mūsu vectēvi dzīvojuši tagadējās ""Mežleju"" mājas vietā šaipus vītoliem, es vēl tur izlauzu akmeņus no agrākā mājas pamata. Otrā pusē atradušās ""Suitu"" mājas. Tā ap 125 gadu atpakaļ toreizējais Vainižu muižas īpašnieks šīs abas mājas muižai."
1172909,"Andreju Klāva d. Golveru. Viņš dzimis kā savu vecāku otrais dēls 1860. 15./27. februārī. Vecākam brālim Jānis izmācoties par mācītāju, viņam bijis jāpaliek par saimnieku. Tēvs viņam nomiris, kad viņam bija tik 12 gadu un šādā vecumā viņš esot sācis strādāt visus lauku darbus. Jaunībā viņš bija ļoti stiprs un darbos, sevišķi siena pļaušanā neviens viņam nevarēja turēt līdzi. Skolu gan viņš apmeklējis tik divas ziemas, bet grāmatu un avīžu lasīšana viņam ļoti labi veicās. Viņš mīlēja vakaros avīzes un grāmatas bērniem un sievai lasīt priekšā, ar to ieinteresēdams arī mūs bērnus uz grāmatu lasīšanu. Kara dienestā nokalpojis piecus gadus Maskavā un Kalugā. Bijis uz parādi ķeizera Aleksandra III kronēšanā. Pārnācis no kara dienesta sācis mājās saimniekot, iepircis no kroņa par dzimtu Āžkalnu mājas. Cik atceros katru gadu bija jāmaksā izpirkšanas maksa 80 rubļi gadā, kas toreiz bij liela nauda. Tāpat uzcēlis dzīvojamo māju un citas ēkas. Apprecējies ar māti 1893. gada 14 (26.) nov. Māte to reiz dzīvojusi turpat kaimiņos Umurgas Miežos pie savas precētās māsas Viktorijas. Nevaru teikt, ka tēvs bija labs saimnieks. Viņš mīlēja turēties pie visa veca, ierasta, saimniekojot pēc vecām parašām, uz visu jauno skatīdamies ar neuzticību. Cik atminos gandrīz katru vasaru pietrūka maizes un bij jaunekļi pirkt pilsētā vaj aizņemoties no radiem. Labību kūla ar rijām. Kuļmašīnu pirmo reizi pie mums ieveda ap 1914. gadu. Mīlēja arī iedzert, no mājām uz krogu gan nekad negāja, bet izbraucot uz pilsētu vienmēr pārbrauca mājās piedzēries. Gadījās vienmēr kādi draugi, kas viņu pierunāja ieiet krogā, izpirka pirmie un kāds tēvs bij drusku"
1172914,"viņi muļķojuši angļus. Es bieži nevarēdams sagaidīt vakaru, interesēdamies kas avīzē rakstīts, bieži skrēju pie mātes lai izlasa kādu vārdu vaj rindiņu kas drukāts avīzē, no parādītiem vārdiem un teikumiem tad pats drīz vien izmācījos lasīt visu kas drukāts avīzē un grāmatās. Māte bieži atveda no sava tēva vaj brāļa grāmatas, sevišķi atminos vecos ""Austruma"" vaj ""Mājas Viesa"" mēnešraksta sējumus, kurus ar lielu interesi izlasīju. Tāpat lasīju bībeli un dziesmu grāmatu. Skolā sāku iet tikai 11 gadu vecumā. Mācības man lielas grūtības nesagādāja, vienmēr bij pirmais vaj viens no labākiem skolēniem. Mani skolotāji Vainižu pamatskolā bij: P. Strazdiņš pēc viņa apcietināšanas par piedalīšanos 1905. gada revolūcijā, J. Epermanis un J. Lezdmačs no Umurgas Kaļļiem. Divās ziemās nogāju Vainižu skolā, tad tēvs mani augusta mēnesī aizveda jau vasaras skolā uz Rozulas ministrijas skolu. Tur mani drīz vien piedalīja 4. nodaļai. Pārbaudei mums lika izrēķinātu kādu aritmetisku uzdevumu, kuru es izrēķināju pirmais nekā ceturtklasnieki. Ceturtā klasē mācības bij krievu valodā, kā: matemātika, vēsture, ģeogrāfija, dabas zinības. Ar krievu valodu vēl lāga neveicās un uzdotos gabalus nācās pa lielāki daļai iemācīties no galvas. Drīz gan biju ielauzījies krievu valodā tiktāl ka tas vairs grūtības nesagādāja. Visās mācības man bij 5 izņemot dziedāšanu kas bij un ir mana vājā puse. Pie kora dziedāšanas mani nemaz nelaida kamēr citi dziedāja es lasīju grāmatas. Mēģināju pie skolotāja Puriņa ņemt klavieru stundas, bet arī tur man bija mazas sekmes. Ņēmu pie Puriņa arī vācu valodas stundas un tīri labi ielauzījos šajā valodā."
1172919,"dzīve mums tur bij laba. Bataljons tika pārdēvēts par pulku, lai gan viņš arī pēc tam bij tikai astoņas rotas. No Ziemeļblāzmas uz pozīcijām izgājām 30. novembra vakarā, izgājām klusu, tā ka rīdzinieki nemaz nemanīja mūsu aiziešanu. Stāvējām kaut kur pie Ložmetēju kalna, tur bija sausa paaugsta vieta, vācu pozīcijas atradās tālu. 19. dec. pārvietojāmies kaut kur pa kreisi aiz Babītes ezera zemā purvainā vietā. Naktī uz 23. decembri sākās daudzinātais latviešu Ziemassvētku uzbrukums. Mūsu ložmetējam ar trešā pulka 6. rotu bij jāpiedalās uzbrukumā taisni mūsu stāvēšanas vietai pretim esošām vācu pozīcijām. Šis uzbrukums bij tikai tāda demonstrācija, lai vācieši neatvilktu spēkus pret galveno uzbrukuma vietu. Galvenā uzbrukuma vieta bij labi tālu no mums pa kreisi un tajā piedalījās visa pirmā strēlnieku brigāde pulkveža Brieža vadībā. Par to ir daudz rakstīts avīzēs un grāmatās un to es šeit neatkārtošu. Mūsu nelaimīgā 6. rota bij izgriezusi eju vācu dzeloņdrātīs, daļa no rotas paspēja arī izskriet cauri šai ejai un vairāk arī neko. Vācieši atklāja tādu šauteņu, ložmetēju un granātu uguni, ka rota drīz vien tika iznīcināta. Vēlāk saskaitīja rotu 60 vīru un bija ap 250. Mūsu ložmetējam bij dots uzdevums pēc vācu ierakumu ieņemšanas atvairīt pretinieka pretuzbrukumus. Mēs gājām kopā ar rotas pēdējiem vīriem un mums izdevās tikt laimīgi atpakaļ bez zaudējumiem. Atminos, man gadījās aiz kāda liela ciņa (tur bija ciņaina pļava) vācu ložmetēja lodes kapā šo cini, bet es"
1172916,"Valmierā. Par laimi dabūju uz vienu gadu atvaļinājumu, jo toreiz biju pārāk tievs un vēl uz kāda panta pamata, kas paredzēja iesaukšanas atlikšanu kamēr otrs dēls nav 16 gadus vecs. Tas varbūt man izglāba dzīvību, jo lielākā daļa toreiz iesaukto aizgāja bojā 1915. gada atkāpšanās kaujās Polijā. 1916. gada janvārī mani noņēma kara dienestā. Bijām labs pulciņš tādu, kam iesaukšana šādu vaj tādu iemeslu dēļ bija pagarināta. Mūs nosūtīja apmācībai uz trešo apmācības bataljonu Pēterhofā pie Somijas jūras līča netālo no Petrogradas. Tur mēs dzīvojām milzīgā ēkā manēža, kur miera laikā apmācīti jātnieki. Šajā ēkā dzīvoja pāris tūkstošu apmācamo kareivju, varēja vaj apmaldīties, kamēr dabūja rokā savas guļas vietu. Jāguļ bij divstāvu nārās, katram jau bij savs guļammaiss. Apmācīja mūs steigā, kā jau kara laikā. Apmācītāji bij dižkareivji un kaprāļi, virsnieki tur bij pavisam maz. Apmācītāji mīlēja daudz, kā jau krievi, lamāties un uzlikt sodus, bet vēlāk, kad dusmas bij pārgājušas uzliktos sodus atkal atlaida. 1915. gada rudenī bij nodibināti latviešu strēlnieku bataljoni un latviešu karavīri no visām krievu karaspēka daļām steidzām turp. Arī mēs visi savas rotas karavīri latvieši iesniedzām priekšniecībai lūgumu pārcelt mūs uz latviešu pulkiem un apriļļa beigās dabūjām atļaujas un mūs nosūtīja uz latviešu rezerves bataljonu Jurjevā tagadējā Tartu Igaunijā. Toreiz bij agrs pavasaris, bet tad atkal uznāca aukstums un uzkrita sniegs. Braucot redzējām savādu ainu: ievas ziedēja, bet koku lapas un zeme bij balta no sniega."
1172907,"vairākās vietās, pēdīgi bij iepircis dzirnavas Latgalē kaut kur pie Krāslavas, bij precējies, palika viena meitiņa, kura arī drīz pēc viņa nomira, dzirnavas mantoja viņa sieva, kura apprecējās otrreiz un tā dzirnavas pārgāja svešās rokās. Šis tēvocis tāpat nomira diezgan jauns. Cik atceros, viņa dzirnavas sauca par ""Baltiņu"" dzirnavām. Tēva brālis Klāvs tāpat palika par dzirnavnieku, rentēja dzirnavas leišos un poļos, īsi priekš 1914. gada kara bij sarunājis pirkt kādas dzirnavas Polijā un daļu naudas iemaksājis, uznākot karam 1915. gadā atbēga pie mums un Āžkalnos nodzīvoju kādu gadu, tad sameklēja kādas dzirnavas Porchoras apriņķī Pleskavas guberņā. Tur pie viņa 1918. gadā es nodzīvoju trīs mēnešus, kamēr tiku šurp uz Latviju. Latvija toreiz bij ieņemta no vāciešiem. 1920. vai 1921. gadā tēvocis ar sievu un dēlu Nikolaju repatriējās uz Latviju, kādu laiku dzīvoja pie mums un tad sameklēja darbu kādās dzirnavās jūrmalā. Viņš nomira Tūjas Melbāržu dzirnavās 1933. gadā, mani brāļi viņu atveda no turienes un paglabāja Umurgas kapos 4. jūlijā blakus savam tēvam Klāvam. Dēls Nikolajs dzīvo pa Rīgu. Tēvoča sieva Paulīne bij latgaliete agrāk kalpojusi pie viņa par saimnieci. Tēva māsa Marija apprecējusies ar kaimiņu Kliesmītes pusmāju saimnieku Jāni Jeršu. Vīram dzīvam esot viņi dzīvoja diezgan turīgi, bet pēc vīra nāves viņai gāja diezgan pagrūti. Viņai bija diezgan daudz bērnu, bet vairāki nomira maziņi. Palika 3 bērni, dēls Gotfrīds, kurš, kā vienīgais dēls bija diezgan izlutināts. Viņš bij dzimis ap 1902. gadu, kara dienestā"
1172910,"iereibis, tad vairs naudu netaupīja, deva dzert visiem pienācējiem. Grūti nācās tādās reizēs viņu dabūt no kroga laukā. Pusi mājas zemes vienmēr vaj nu izrentēja vai izgraudoja. Reiz pieņēma kalpu Tomu Lapiņu. Tam bij jādod daudz labības, tagad rudzi nepaauga tā ka pašiem necik neatlika.Visu mājas zemi sākām paši apstrādāt pēc 1914.–1919. gada kara, kad mēs, dēli, pārnācām no kara dienesta un tad labklājība gāja strauji uz augšu. Tēvs neko nepretojās, kad pārnākuši no kara dienesta sākām paši rīkoties un saimniekot. Vēlāk mājas pārdalīja uz pusēm starp brāļiem Alfrēdu un Arturu, man viņi palīdzēja uzcel ēkas un deva zirgu un divas govis līdz. Tēvs savā mūžā nav neko slimojis. Saslima ar kuņģa vēzi un pēc pāris mēnešu slimošanas nomira 16. maijā 1935. gadā 76. dzīves gadā. Debesbraukšanas dienā 26. maijā paglabājām Umurgas kapos. Mūsu māte Katrina Emilija Galvera dzimusi Jirgena ir Augstrozes skolotāja un ērģelnieka meita dzimusi Augstrozes Laures kalnā 1868. gada 15. (27.) aprīlī. Viņas tēvs darbojies ilgus gadus par ērģeļu spēlētāju Augstrozes baznīcā un bij plaši pazīstam kā ērģeļu būvētājs. Viņa taisītās ērģeles bija atrodamas visās apkārtējās skolās, arī Vainižos. Viņš un tāpat viņa sieva mūsu mātes māte nodzīvoja ilgu mūži pāri 80 gadiem un nomira dēla mājās Mazstraupes Klāniņos. Viņiem bij pavisam 7 meitas un viens pats jaunākais dēls. Meitu vārdi: Amēlija, Viktorija, Matilde, Alvīne, Anna un Emma. Mūsu māte laikam pēc vecuma bij piektā meita. Amēlija bij precējusies ar kādu skolotāju Bērziņu, viņai bērna nebij. Viktorija bij kaimiņos Umurgas Miežos par saimnieci. Viņas vīrs uzvārdā Skancis nomira jauns"
