File-ID,Transcribed Text
1172934,"toties atāls auga lieliski. Nopļāvu un izkaltēju 8 lielus vezumus atāla. Šogad iegādājos zāles pļāvēju. Piena cenas pavisam nokritās, par kilo sviesta maksāja tik 70–80 santīmu, tā ka es pārtraucu pienu vest. 15. sept. Limbažos pienāca pirmais vilciens. 1935. gadā sniegs nokusa jau februāra beigās. Martā reizēm uzsniga un atkal nokusa un galu galā pavasars bij diezgan vēls un vēss, jūlijā sauss un rudens lietains. Raža vidēja, saknes vājas. Nopirku cirsmu pie Runeiša par 245 latiem, tur bij malka un baļķi, kurus sazāģēju dēļos. 1936. gads palika atmiņā kā ""sausais gads"". Nebij nekāda lāga ziema, sniegs nokusa agri un aprīļļa beigās bij jau stipri silts. Pirmās zirņauzas iesēju jau 2. maijā un pārēji labību arī iesēju agri. Pavasaris, vasara un rudens bij sausi. Uzlija gan pārkoņu lietus diezgan bieži, bet pēc tam vienmēr bij sauss un zemi ātri izžāvēja. Viss nāca agri pļaujams vaj novācams. 15. maijā ziedēja ievas. Šinī gadā iegādājos labības pļaujmašīnu, tā kā pļaušana labi šķīrās. Rudzus nopļāva no 20–
25. jūlijam un vasarāju no 3–
11. augustam. Rudzus nokūlu 6. augustā un vasarāju 3. septembrī. Kartupeļus noņēmām no 11–
21. augustam. Labības birums šogad man bij vidējs, tiem kas vēlu sēja bij vājš. Sakņaugu šogad maz. Uzbūvēju cūkkūtiņu, istabas izlīmēju ar tapetēm. Lidija rudenī sāka iet skolā. 1937. gada pavasaris arī bij agrs. Ievas zied ap 14. maiju, ābeles ap 17. maiju. Raža apmierinoša –
 paauga labi arī āboliņš un kartupeļi. Mirdza sāka rudenī skolā iet. Ēvalds un arī Maiga daudz slimoja. 1938. g. jau priekš Ziemassvētkiem uzkrita biezs sniegs uz nesasalušas zemes, janvārī un februārī bij ļoti biezs sniegs, kas daudziem izpūdēja rudzus. Sniegs nokusa jau marta sākumā. Vasarā un pavasarī lietus bij pietiekoši un rudenī jau bij pārāk daudz."
1172922,"vada komandieri vecāko unteroficieri Pēteri Enni, kuram lode trāpīja taisni pierē. Vēl ievainoja kareivjus Bāliņu un Rīsteri. No rotām ievainoja vaj nošāva lielāko pusi. Krita daudz virsnieku. Otra nelaimīgā diena pulkam bij 17. (30.) janvāris. Tad vācieši uzbruka krievu 11. Sibīrijas strēlnieku pulkam, tie atkāpās un mums steidzīgi bij jāiet tiem palīgā pretuzbrukumā. Vāciešus gan aizdzinām atpakaļ, bet arī mums bij lieli zaudējumi. Krita vaj tika ievainoti daudz virsnieku un strēlnieku. Krita ar 2. bataljona komandieris poručiks Elsis. Šajā kaujā arī man iznāca krietni vien piedalīties. Biju pie ložmetēja kā 2. numurs, pats pie mērķēšanas un šaušanas gan netiku, jo šāva pirmais numurs Jaunzems, bet bija jāpalīdz pie šaušanas, jānes vaj jāvelk ložmetējs. Pēc šām kaujām mūsu pulks bija pavisam samazinājies. 26. janvārī pārnācām atpūtā uz Rīgu agrākās mītnēs Kuldīgas ielā 14. Tur mums atsūtīja papildinājumu no rezerves bataljona. Arī mūsu komandai pienāca 40 jauni ložmetējnieki. Komanda tika pārformēta un sadalīta 6 vados. Es tiku iedalīts 2. vada pie otra ložmetēja kā pirmais numurs – наводчик. Šeit Kuldīgas ielā mēs nodzīvojām 2 mēnešus, bij atkal ierindas mācības, mācības ar ložmetēju un tā tālāk. Te mēs sagaidījām februāra revolūciju un tās sekas. Disciplīna pulkā pamazām izira un pulka kaujas spējas samazinājās. Kareivjiem gan dzīve palika vieglāka un patīkamāka. 1917. gada janvārī iesauca kara dienestā 1898. gadā dzimušos, starp tiem arī manu brāli Alfrēdu. Viņu apmācīja rezerves bataljonā Smiltenē un pēc tam tika iedalīts 2. Rīgas"
1172935,"Raža bij laba, rudzus iekūlu ap 120 pūru un valstij nodevu 5 tonnas rudzu. Vasarājs, āboliņš, kartupeļi un saknes labas. Ienākumi naudā labi. Mirdza no 10. marta līdz 25. aprīllim bij Limbažu slimnīcā – slimoja ar slapjo plevrītu. Es pats arī pārpūlējos un samaitāju sirdi. 1939. agri nokusa sniegs, bij kailsala un atkusnis, tā kā ļoti stipri iznīcināja āboliņu. Man iznāca tik 15 kaudzes. Pavasaris pavēss un lietains, bet jūlijs, augusts un septembris ļoti sausi, lietus reti uzlija. Arī oktobrī un novembrī maz nokrišņu, tik uz Ziemassvētkiem sanāca biezs sniegs. Rudzi šogad man atkal iznāca 120 pūru, arī auzas un kartupeļu diezgan. Pats es stipri mocījos ar sirdi –
 kad tik dabūju aukstumu vaj ko celt, tad bij grūti. Pa vasaru –
 silto laiku gan varēju strādāt un savu zemi apkopt. 1940. gads. Janvāris un februāris noturējās ļoti auksti ar dziļu sniegu. Sals daudzreiz sniedzās pāri 30°
 C un dažas dienas pat bija pāri 40°
. Tāpat marta mēnesī bij stingra ziema. Ar sliecēm brauca līdz pus aprīllim. Sniegs nokusa palēnām un lieli plūdi nebija. Līdz pat Jāņiem bij vēss un sauss laiks. Pa siena laiku un visu rudeni bij stipri lietains un aizkavēja darbus. Lielais sals nosaldēja visas ābeles. Ja es nebūtu pasteidzies apzāģēt, varbūt kāda būtu vēl atdzīvojusēs. Pļavās siens un tīrumā āboliņš bij pavisam vājš. Rudzi man un tāpat citiem kaimiņiem paauga vareni. Rudziem man bij rekordbirums –
 52 maisi ap 135 pūri, auzas 65 maisi –
 150 pūru no 6 pūrvietām. Kartupeļi un saknes labi auguši. Latvijai šis bij liktenīgs gads, ienāca krievu karaspēks un nodibinājās padomju"
1172928,"mūsu 14. rotā un mani pielika par to vadītāju. Vēlāk šo ložmetēju nodeva ložmetēju rotai un mēs abi ar Alfrēdu pārgājām ložmetēju rotā. Stāvējām dažādos ciemos un viensētās tagadējās Abrenes un Kārsavas rajonos. 11. augustā 1920. gadā tika parakstīts ar Padomju Savienību miera līgums. Tad mūsu pulks ieņēma robežapsardzības dienestu. Septembra sākumā mani pārcēla par rakstvedi uz rakstvežu komandu pulka štābā, kas stāvēja Višgorodas ciema skolas ēkā. Tur nokalpoju gandrīz pusgadu līdz manai atvaļināšanai no kara dienesta. Tur diezin kāda patīkama dzīve vis nebij skatoties pēc dzīvokļa un pārtikas stāvokļa, bet varēja daudz ko iemācīties, kas dzīvei vēlāk labi noderēja. Par visu, kas man gājis pa kara dienestu laiku var palasīties manās piezīmēs, kabatas kalendāros, kur svarīgākie notikumi ir tuvāk aprakstīti. Arī vēlāk es katru dienu atzīmēju kas tajā dienā darīts un citus svarīgākos notikumus. 24. februārī 1921. gadā tiku atvaļināts no kara dienesta kā jaunākais rakstvedis (divas strīpiņas uz uzšuvēm) un pārbraucu mājās Āžkalnos. Tajā pašā pavasarī man tika piešķirta zeme no Vainižu muižas zemes. Zemes gabals Nr 29. 14,4 hektāri. Pirmā reizē gan man zeme netika piešķirta – manam tēvam esot zemes diezgan –
 pārsūdzēju tālāk, bez tam vēl bij izdarītas citas nepareizības un tamdēļ pirmo piešķiršanu atcēla un pie otrreizējas dalīšanas arī es dabūju savu gabalu. Tagadējais Inka Ozoliņš toreiz bija par zemes dalīšanas komitejas priekšsēdētāju, to reiz viņu saukāja par ministru. Viņš pats sev iedalīja pašu labāko gabalu par kuru viņš visādi pūlējās."
1172938,"1945. gada ziema nebij visai bārga un sniegs pa vidam, kas nokusa palēnām un nebij lielu plūdu. Pavasars bij pavēss un vasara un rudens lietaini. Ražas ziņā šis gads bij sliktāks par pagājušo gadu. Āboliņš uzauga pavisam maz, tāpat labība un kartupeļi mazāk. Piena šovakar bij maz, bij tikai 3 slaucamās govis un no tām divas ālavas. Pavasarī viena govs nobeidzās un viena grūsna tele noslīka, tāpat nobeidzās kumeļš un nodega pirts. Daudzi aizsargi tika notiesāti spaidu darbos un citi šur tur bēguļo. 1946. ziema nebij visai un sniega arī ne visai daudz, tāpat kā iepriekšējā gadā. Vasara vēsa, maz dabūju sauļoties. Decembrī brauca ratiem, ka kūpēja vien. Raža ne visai laba. Āboliņš gan paauga labi, tāpat rudzi un kvieši, bet no auzām nebij nekā, saēda rūsa un nokņāpu gar zemi. Pūrs auzu svēra tik ap 24 kilo. Krievijas dienvidos šovasar sējumi izdeguši, tur ir bads. Spieda mums nodot labību virsnormā un pārdot valstij iepirkumos. Šovasar Lidija un Mirdza izgāja iesvētīšanas mācībā un 28. jūlijā Umurgas baznīcā tika iesvētītas. Mirdza septembrī pārgāja uz Rīgu mācīties frizieres amatu. Maiga pabeidza pamatskolu un rudenī sāka apmeklēt vidusskolu. 1947. gadu var saukt par sauso gadu, jo nokrišņu bij maz. Ziema bija diezgan auksta, bij pat 35° sals. Sniegs pietiekoši uzkrita tik ap februāra vidu, baļķus no Melnā meža uz Dauguļiem veda pa pusmelnu zemi. Pavasaris bij sauss, zemi sāka strādāt diezgan agri un apsējās agrāk kā citos gados. Tāpat vasara un rudens līdz novembrim bij sausi. Sevišķi vāja šogad bij āboliņu un siena raža. Āboliņš kailajā ziemā izsala. Izauga tik 18 kaudzes no 9 pūrvietām, tas pats skābenes un"
1172929,"Pirmo 1921. gada pavasari es pats apstrādāju tik 7 pūrvietas no savas zemes, pārējo izrentēju meldera brālim Jānim Pētersonam, kurš rudenī iesēja 4,5 pūrv. rudzu. Arī nākošos 1922–23 gadā pļavas dažas pūrvietas zemes devu lietošanā Jānim Gulbim, viņam tāpat devu lielāko daļu no salmiem par ko viņš maksāja un deva kūts mēslus zemes mēslošanai. Brālis Arturs 1922. gadu bij kara dienestā, visu zemi nācās apstrādāt abiem ar Alfrēdu. 1923. gada ziemā sagādājām būvmateriālus un uzcēlām kūti Mazlejās, dzīvojamo ēku uzcēlām 1924. gadā. Žol. Mežgailis no Priedītēm bij par meistaru un mēs trīs brāļi dūšīgi strādājām pie būves un citus darbus. Jumtus ēkām es viens pats uzsitu, tāpat ielikām grīdas un griestus. 1925. gada pavasarī piebūvējām kūtij barības šķūni. Šajā gadā pabeidzām galīgi izbūvēt dzīvojamo ēku –
 iemūrēju skursteni un rierus, ielika logus un durvis. 1925. gada 15. novembrī bij mūsu kāzu diena. Apprecēju Karlīnu Mārča meitu Stumpi no Vainižu Ušām. Viņa dzimusi 1902. gada 7.(20.) martā Augstrožu Ķilkās. Viņas tēvs Mārcis Stumps dzīvojis vairākās mājās Vainižos un apkārtnē, kā: Kliesmītēs, Vec-Ķeņos, Rozalas Āžkalnos un beidzot Maz-Straupes Entēs, pirmā pasaules kara laikā viņš nopirka Vainižu Ušas mājas. Tās bij plašas mājas ap 100 pūrvietas aramzemes, mežs, pļavas. Līnas māte nomira ar vēzi, kad viņai bij 18 gadu un viņai bij jāvada saimniecība. Vēlāk vecais apprecējās otrreiz ar Almu Matisoni no kaimiņu Klētniekiem. Vecajam Ušam bij divi brāļi, viens nomira neprecējies, otrs Jānis braukāja apkārt uzpirkdams gaļu un citas preces un veda šīs preces uz Rīgas tirgu."
1172932,"1928. gads bij tā saucamais ""slapjais gads"". No pavasara sākuma līdz 8. maijam bij apžuvuse, varēja pat slapjākās zemēs strādāt, bet tad palika vēss, sāka bieži līt un reizēm nāca pat sniegs, tā ka zemes darbi apstājās pat sausākās zemēs. Kam stingrākas māla zemes, tas vaj nu nemaz nedabūja iesēt, vaj iesētā labība iznīka un noslīka. Manā smilšainā zemē zaudējumi nebij visai lieli. Vasarāju labība iztrūka ap 30–40 pūru, tāpat kartupeļi izaugtu ap 100 pūri vairāk. Rudzi bij labi, arī āboliņš audzis ļoti labi, tā ka lopbarības pietika. Šajā gadā izbūvēju labības šķūni, kas šajā slapjajā gadā labi noderēja. Tāpat šinī gadā nopirku kartupeļu rokamo mašīnu. 1929. gads bij tāds vidējs gads, raža vidēja, laiks arī tāds ne sauss, ne slapjš. Bij Fogeļu Olga par dienestmeitu. Tēvs ar Ernestiņu Bersei pārņēma no Vainižu Patērētāju b-bas kuļgarnitūru. 1930. bij auglīgs gads. Pavasarī sniegs nokusa agri un jau ap 7. aprīlli varēju sākt zemi strādāt. Sienalaiks gan bij samērā lietains bet toties auga labība. Labība nāca agri gatava. Jau 7. augustā nokūla rudzus Mazllejās. Augustā uznāca ļoti stipra lietus gāze, kas iznesa tiltu pie Strautiņiem –
 toreiz vēl nebij jaunais tilts un dambis, daudzreiz nācās braukt pāri, kad ūdens smēlās vāģos un gāja pāri vāģu kurvim. Visu novembra pirmo pusi bij silts un ārkārtīgi lietains un atkal iznesa tiltu. Rudzu, vasarāju un kartupeļu raža bij ļoti laba. Toruden valsts sāka iepirkt no zemkopjiem labību. Toreiz vēl nebij Limbažos dzelzceļa un rudzus nācās vest uz Ozolu staciju. Toruden iegādājos radio aparātu. 1931. gadā ļoti ilgi pieturējās biezais sniegs, uznāca liels siltums un nokusa ātri un"
1173183,"labību aizveda uz Limbažiem valsts noliktavās un mēbeles saveda vienkopus un pārdeva. Pēc šādām briesmām visi pārējie zemnieki bij nobijušies un vairs nedrīkstēja pretoties kolhoziem, jo baidījās no otrreizējās izvešanas, kā to piedraudēja kādā sapulcē komunīsts Bāliņš. Vainižu pagastā nodibinājās pavisam pieci kolhozi: ""Drosme"", ""Progress"", ""Draudzība"", ""1. maijs"" un mūsējais ""Jaunā dzīve"". Mūsējo kolhozā par pr-ja bij izraudzīts Ziedkalna dēls Vilis Pētersons un par rēķinvedi pieņēma manu meitu Lidiju. Iztrūkstošā sēkla bij atkal jāved uz rudens atdošanu no Limbažiem atpakaļ. Pirmo pavasari mēs strādājām dūšīgi, iztikām bez trakotru palīdzības. Pavasaris bij agrs un izdevīgs, apsējām labi. Jūlija un augusta mēneši bij lietaini, visas pļavas nevarējām nopļaut. Rudzi bij pavāji, bet vasarāja raža laba. Milzum daudz labības bij jānodod valstij, tāpat piespieda nodot traktoru stacijai, lai gan tā mūsu kolhozā neko nedarīja, bez tam kādas 15 tonnas labības bij jānodod virs plāna. Tomēr ar visu to uz izstrādes dienu varēja izsniegt 2,7 kg labības, 4 kg kartupeļu un 1,25 rbļ. naudā. Tādu apmaksu turpmākos gados vairs nevarēja sasniegt. 1949.–50. gada ziemā mūsu kolhozam bija jāsacērt 1900 ciešmetri kokmateriāla Salacas pagastā pie Zonepes stacijas. Es arī braucu 3 reizes uz turieni pa dzelzceļu un beidzot ar zirgu. Kolhozā bij daudz vairāk jāstrādā, kā savā bijušā individuālā saimniecībā , brīva diena reti kad gadījās un par visu lielu darbu saņem tik niecīgu apmaksu. 1950. gadā atkal bij agrs pavasaris, ievas ziedēja ap 8. maiju. 2. maijā mūsu"
1173186,"ar ziediem. Rudenī bij bagāta ābolu, ķiršu un jāņogu raža. Es līdz 21. maijam gāju kolhoza darbos, tad paliku slims ar sirdi. No 1.–21. jūnijam biju Limbažu slimnīcā, tur man maz ko varēja palīdzēt. Atlaižot no slimnīcas ārste Viļuma man teica ""Nekāds spēka vīrs vairs nebūsiet, labi ja varēsit lēnām pastaigāt un kādu vieglāku darbiņu pastrādāt."" Tā jau arī ir. Līdz ko drusku reizēm pastrādāju ir grūti ar sirdi, un vēlāk ar plaušām kas no zāļu lietošanas arvien vairāk tiek sabojātas. Vairākas reizes domāju ka nupat gals man ir klātu, bet izrādījās, ka pēdējā stunda man vēl situsi. Noslimoju visu 1955. gadu un šodien ir 1956. gada 19. aprīllis. Daudz gan viens nevaru –
 kādu gabaliņu pastaigāt. Sirds, plaušu artērija ķepē ciet, nepiegādā asinis plaušām. Zāles ""jodots"" ko lieto pret artēriju pārkaļķošanu atkal nepanes plaušas, kuru pūslīši ir stipri paplašinājušies. 1955. gada ziema nebij nekāda bārgā, bet pavasari gan ļoti nokavējās. Sniegs nokusa tik aprīļļa beigās. Maija mēnesī bij stipras lietus gāzes un upe 4 reizes pārplūda. Zemes darbi ļoti nokavējās. Vasara bij ļoti silta un arī sausa, tāpat rudens silts, tā kā dabūju novākt ražu. Decembrī gan sakrita biezs sniegs un uznāca stiprs sals. Kartupeļi mums pašiem izauga ļoti labi, arī saknes pietiekoši. Jāņogu daudz, ābolu gan maz. Par 1954. gadu kolhozs uz darba dienu deva 230 grami labības un 2 rubļi naudā, par 1955. g. 600 grami rudzu un 39 kapeikas naudā. Visi kolhoznieki palika kolhoza parādnieki. Līna audzēja kopā priekš kolhoza 0,5 ha cukurbietes tepat aiz mūsu kūts. Es palīdzēju ravēt un retināt un rudenī nodarināt. Iznāca tik 2300 kilogrammu bietes."
1173188,"Brālis Arturs dzimis 1901. gada 30. sept. Skolā gājis trīs ziemas. Pusgadu kopā ar mums vecākiem brāļiem pusgadu dienēja Latgales partizāņu pulkā un vēlāk gadu obligātā kara dienestā. Kopā ar brāli Alfrēdu uzbūvēja jaunas ēkas, meliorēja pļavas un labi iekopa zemi Āžkalnos. Bij aktīvs sabiedrības darbinieks pagasta biedrībās un aizsargu organizācijā. 22. februārī 1925. gadā apprecējās ar Alvīni Labari, dzimušu 1906. gadā. Viņu meita Rasma dzimusi 2. okt. 1936. g. Beigusi Limbažu vidusskolu 1955. g. Pēc boļševiku uzvaras 1944. gadā brālis Arturs pāra gadus strādāja kādā Rīgas rūpnīcā un vēlāk pats pieteicās un tika notiesāts uz 25 gadiem katorgā. Dabūja izciest pāri pa 7 gadiem, kad uz amnestijas pamata tika atbrīvots un tagad strādā Rīgā. Zeme tika atņemta un manta konfiscēta jau 1944. gadā. Brālis Ernests dzimis 1910. gada 16. aprīllī. Apmeklēja Vainižu pamatskolu un pabeidza Rozulas 6 klašu pamatskolu. Mācījās arī Limbažu vidusskolā 2 gadi. Tad bij ilgāku laiku slims un vidusskolu vairs nepabeidza. Strādāja kā kuļgarnitūras vadītājs un vēlāk pats bij kuļmašīnas īpašnieks. Tepat viņš iegādājas zāģu gateri. Tomēr melnais darbs pie mašīnām viņam nebij pa prātam, tamdēļ viņš palika par kanceles darbinieku. Nolika pagasta darbveža palīga un vēlāk pagasta darbveža eksāmenu. Bij darbveža palīgs Vainižos un vēlāk pagasta darbvedis Augstrozes pagastā. 1944. gadā boļševikiem atgriežoties bij darbveža amats jāpamet un gadu pusotru viņš bēguļoja, tad pieteicās milicijai. Pie tiesas gan viņu nesauca. 1935. gada 1. janvārī viņam bij kāzas ar Veltu Āboltiņu dzimušu 1914. gadā. Velta beigusi Limbažu vidusskolu. Viņiem ir bērni: meita Dzidra dzimusi piektdien 17. aprīllī 1936. gadā, dēls Juris, dzimis 1938. g. 25. martā arī piektdienā un meita Māra dzimusi 1945. vaj 1946. gadā. No 1944. gada rudens viņu ģimene dzīvoja sievas jaunsaimniecībā Vainižu Purmaļos."
1173184,"kolhozs sāka sēšanu un sēja un stādīja līdz 15. jūnijam. Jūlijā iesākās mazo kolhozu apvienošana, Vainižu pagastā palika divi kolhozi – mūsējais ""Uzvara"" un Ždanova vārdā nosauktais. Par kolhozu pr-ju nāca Dobrovs, rēķinvedi Ķillis, Lidija bij par uzskaitvedi un Vilis pr-ja vietnieks un noliktavas pārzinis. Raža šogad vēl bij tīri laba un paspējām arī novākt, daudz labības bij jānodod valstij. Uz darba dienu iznāca 2,4 kg labības, 1 kīlo kartupeļu un 1,29 rbļ. naudā. Šajā gadā šādi notikumi ģimenes dzīvē: Maiga pabeidza vidusskolu un rudenī iestājās medicīnas māsu skolā pie IV. Rīgas pilsētas slimnīcas, Ēvaldam bij aklās zarnas operācija, Limbažu slimnīcā bij no 29. jūlija –
 12. augustam, Mirdzu ievainoja automobilis, kas to bij piespiedis pie mājas sienas. Ievainota kāja un drusku saspiestas krūtis. Lidijai 6. novembrī. piedzima meitiņa Ārija un viņa sarakstījās ar Vili Pētersonu, viņi dzīvoja pie mums līdz pavasarim un tad pārgāja dzīvot Āžkalnos. Pa ziemu kolhozam bij jāsacērt 2400 ciešmetri koksnes un jāizved 1300. Tur pagāja kādi 3 mēneši. 1951. gadā zemi varēja sākt strādāt diezgan agri, bet pavasaris līdz pat Jāņiem bij vēss, apsala pat ābelēm, ķiršiem un pat jāņogām ziedi un bij vāja ābolu un ogu raža. Rudzu raža bij vāja, vasarāju apmierinoša. Par izstrādes dienu izsniedza 2 kilo labības un 54 kapeikas naudā. Ēvalds pabeidza pamatskolu un sāka iet Limbažu vidusskolā, dzīvoja internātā. 4. febr. nodega ciema padomes ēka Kļaviņi un ciems pārgāja uz Strautiņiem. Tāpat nodega 3. septembrī skaistais Umurgas biedrības nams, un dažas dienas agrāk nodega Pociema lauksaimniecības biedrības nams. 1951–
2. gada ziemā kolhozam bij jacērt un jāved kokmateriāli Raunas pagastā, jāved uz Dzērbenes staciju."
1173185,"1952. gada pavasarī arī varēja agri sākt zemi strādāt. Pavasaris bij vēss, rudens lietains. Ražas novākšana ievilkās vēlu un kūlām vēl nākošā gada februārī. Daži hektāri kartupeļu palika nenovākti. Uzkrita biezs sniegs uz nesasalušas zemes, nenoņemtie kartupeļi vēl bij lietošanai derīgi – raka priekš kolhoza lopiem. Par izstrādes dienu 1,5 kg labības un viens rublis naudā. Meža darbi Sveiciemā un Kirbižos. Es pāri mēnešu biju pie kokmateriālu izvešanas, biezā sniega un nesasalušas zemes dēļ stipri nomocījos un sabeidzu veselību. 26. febr. 1952. Lidijai Āžkalnos piedzima puisēns, kurš nākošu gada janvāra sākumā nomira un 10. janvārī to paglabāja Umurgas kapos. Maiga pēc med. māsu skolas beigšanas dažus mēnešus bij darbā Preiļu rajonā un no 1. decembra 1952. g. sāka strādāt par medicīnas māsu jaunatvērtā Vidrižu lauku slimnīcā. 1953. gada pavasarī biezais sniegs ātri nokusa, zeme drīz vien apžuva un varēja zemi strādāt. 14. aprīllī jau sēja pirmās auzas. Ap 7to maiju uznāca sniegs un apmetās auksts, tāpat maija beigās bij salnas un vēss laiks. Sēšanu nobeidza jūnija sākumā. Zirgi bij ļoti vāji, sējas laikā vairāki zirgi vairs nespēja vilkt un bij jāatbrīvo no darba. Rudens bij silts un lietains, kartupeļus paspēja norakst, bet ar kulšanu nenieka. Uz darba dienu tik 700 grami labības un 1 rublis. Meža ciršana bij Pociema mežā –
 izcirtām jau decembrī. Kolhozs gājis stipri uz leju. No hektāra caurmērā izkulti 6,6 centneri labības, piens izslaukts 1300 litri no govs. Naudas ieņēmumi arī daudz mazāki. 1954. nebij nekāda bieza ziema, sniegs nokusa jau ap pus martu, bez aprīlli un maijā bij biežas nakts salnas. Ievas ziedēja ap 18. maiju. Ābeles ziedēja ap 26. maiju, visas bij pilnas"
1172940,"Mirdza izmācījās par frizieri un sāka strādāt patstāvīgi. Rīgā šos pēckara gados bij grūtības ar pārtiku, mums bij jādod Mirdzai un jāpārdod Zalcmaņiem daudz gaļas, kartupeļu, miltu, putraimu un citu pārtikas produktu. Turpat citi rīdzinieki braukāja apkārt pa laukiem iepirkdami lauku ražojumus savai iztikai. Rudenī sāka rakstīt laikrakstos un stāstīt sapulcēs par kolhoza labumiem un aicināt zemniekus dibināt kolhozus, bet atrada maz dzirdīgas ausis. Nodibinājās arī pirmie kolhozi Latvijā. 25. martā 1949. gadā – latviešu tautas sēru diena. Pa nakti piebrauca klāt čekisti un vietējie varas vīri, pavēlēja sakrāmēt līdzņemamas mantas un braukt šiem līdzi. Cilvēki no uztraukuma paķēra līdzi dažādas mantas, bieži visvajadzīgākās atstājot mājā. No mūsu pagasta aizveda kādas 70 personas: Lielķītu, Mazķītu, Osv. Varblanu, K. Liepiņu, J. Krauļi, Tāšu Pīkšēnu, Viķenu, Selkeļu Rīmeru, Krocas, Jaunzemu, Lidmeņu brāļu Ernestu, brāļa sievu Grietu ar ģimeni un vēl citas. Ar zirgiem aizveda līdz Umurgai un no turienes ar auto uz Valmieru un tālāk pa dzelzceļu uz Sibīriju, Omskas un Tomskas un dažus arī uz Amūras apgabaliem. Agrāk lasīju grāmatās ka Āfrikā ķēruši nēģerus veduši uz Ameriku un pārdevuši par vērgiem. Neticami ka XX. gada simtenī varēja šādas lietas notikt. Bez kaut kādas tiesas un izmeklēšanas daži varasvīri sastāda viņiem nepatīkamo personu sarakstu, daudzas ģimenes nemaz nebij ievestas ""kulaku"" sarakstā un dažus tā dēvētos ""kulakus"" atstāja mierā. Palikušo sēklu un pārējo"
1173189,"1949. gada 25. martā latviešu izvešanas laikā Ernesta sieva ar bērniem, tēvu un māti un vecmāmiņu tika aizvesti uz Sibīrijas Tomskas apgabalu. Ernests pats vaj nu nebij mājās vai aizbēdzis kur citur un palika neaizvests. Tomēr pēc gada viņš pats labprātīgi par savu naudu aizbrauca uz Sibīriju pie savas ģimenes. Mājās visa iedzīve un inventārs tika pārdoti un izputināti. Sibīrijā nomira un apglabāti Veltas vecāki un vecmāmiņa. Pati Velta saslima ar dzemdes vēzi un meita Dzidra ar locītavu reimatismu. 1956. gadā martā Ernests ar sievu un bērniem pārbrauca no Sibīrijas savā mājā Purmaļos, iestādamies kolhozā. Kolhozs viņiem deva slaucamo govi un citāda veida palīdzību. Velta jau bij neārstējami slima, vēl nomocījās visu varu un 7. novembra rītā 1956. gadā viņa nomira. Svētdien 11. novembrī viņu paglabāja mūsu ģimenes kapu nodalījumā. 1956. gada septembrī no Sibīrijas pārbrauca arī brāļa Alfrēda sieva Margrieta ar abām meitām. Biruta Sibīrijā ilgi slimojusi ar kājas kaula tuberkulozi un labā kāja viņai ir nespēcīga. Viņa apmetās uz dzīvi Rīgā pie mātes māsas Klabienes. Grieta ar jaunāko meitu Āriju palika uz dzīvi savās mājās un tagad kopj grupu kolhoza slaucamo govju. No kolhoza viņai deva govi, sienu un drusku labības."
