File-ID,Transcribed Text
1172906,"kapa krusta Umurgas kapsēta ir uzraksts ar viņa dzimšanas un miršana datiem. Pēc viņa nāves saimniecību vadījusi viņa sieva, mana vecmāte. Viņu es drusku atceros kā lieku niknu sievieti kurai bija grūti pa prātu izdarīt. Viņas mātes uzvārds bija ""Krūze"", bet kristīto vārdu, diemžēl, es neatceros. Viņa nomira ap 1898. gadu, kādus tīs gadus gulēja uz gultas, jo ķermeņa labo pusi bij ķērusi trieka. Viņai jau arī nav klājies viegli vīram jaunam nomirstot palika 6 bērni no 2–14 gadu vecumā. Kā viņa spēja tos visus izaudzināt, vecāko dēlu Jāni izskolot par mācītāju un divus jaunākos dēlus Mārtiņu un Klāvu izvadīt agrāk sauktā ""Kreicskolā"". Viņai bij 6 bērni, dēli: Jānis, Andrejs mans tēvs, Mārtiņš un Klāvs un meitas: Marija un Kristīne. Vecākais dēls Jānis, pabeidza Tērbatas universitātes teoloģijas fakultāti. Mācītāju vietu Latvijā viņš nevarēja dabūt, jo toreiz noteikšana par mācītāju vēlēšanu piederēja baroniem un tie latviešus mācītāja amatā labprāt nelaida. Tēvocis bija par mācītāju Odesas vaj Kijevas kara apgabalos un laikam apkalpoja arī turienes ev.-luterāņu draudzības. Viņš bij precējies kādu vācu ārsta meitu v. Dornburg, kura dabūja pūrā kādu muižiņu Besarābijā. Viņiem bija divi dēli, kuri gan skaitījās par vāciešiem. Tēvocis nomira jauns, braucot pavasarī amata darīšanās pāri upei, ielūzis caur ledu upē, pamatīgi izmērcējies, saaukstējies, saslimis un ar to pašu nomiris. Viņu es drusku atceros, jo viņš bija atbraucis Āžkalnos uz savas mātes bērēm. Tēvocis Mārtiņš pabeidzis ""kreicskolu"" izmācījies par melderi, rentējis dzirnavas"
1172921,"jams, labi ja tāpat stāvot varēja kādu brītiņu nosnausties. Otras dienas vakarā visa latviešu strēlnieku pirmā brigāde pārvietojamies uz otrās brigādes uzbrukuma vietu pie ložmetēju kalna. Tur vācieši nebij spējuši izsist strēlnieku no ieņemtā apvidus. Tur strēlnieki un sibīrieši vēl vietām gāja uzbrukumā un paplašināja ieņemto apvidu. Man tur kaujās piedalīties neiznāca. Bij liela salšana un nīkšana sniegā aizsardzības ķēdē. 31. janvārī mūsu ložmetēju atvilka rezervē pie komandas transporta Lāča mājās. 1. janvārī visu 3. pulku izmainīja un tas pārgāja atpūtā uz Rīgu. Visas komandas mantas nevarēja uzreiz aizvest uz Rīgu un mūsu ložmetēju ļaudis palika tās apsargāt Lāčos līdz 5. janvārim, kad arī mēs ieradāmies Rīgā. Mūsu ložmetēju komanda dzīvoja Kuldīgas ielā 14 trīsstāvu mūra namā. Rīgā nedabūjām ilgi dzīvot, jau 10. janvāra vakarā mūs steidzīgi izsauca uz pozīcijām. Vācieši bij gājuši uzbrukumā un atspieduši krievu daļas gandrīz līdz saviem agrākiem ierakumiem. 12. janvāra rītā gājām vairāki latviešu pulki uzbrukumā. Šim izbrukumam nebij nekādu panākumu – aizgāja bojā lielākā daļa no mūsu pulka. Uzbrukuma vieta bij purvs apaudzis ar retām priedītēm. Uzbrukumu izdarīja viļņveidīgi, pulku. Priekšējā vilnī bij 7. un 8. rota un mūsu komandas 3. vads ar 2 ložmetējiem. Mūsu komandas 1. vads ar 2 ložmetējiem bij 3. vilnī. Pazuda abi trešā vada ložmetēji ar visiem kareivjiem un komandas priekšnieku poručiku Šreiberu kurš gāja tiem līdzi. Palika pāris kareivju kas tika ātrāk ievainoti. Arī no 2. ložmetēju vada vairāki krita un citi tikai ievainoti. Mūsu pirmā vadā nošāva"
1172930,"Arī mūsu nobarotās cūkas viņš uzpirka un aizveda uz Rīgu. Tādējādi viņš bij ticis pie naudas un nopirka Rīgas tuvumā Ādažos kādu jaunsaimniecību. Viņš mira 1938. gadā, atstājot vienu meitu. Vēl sievas tēvam bij māsa Kristīne, precējusies ar Jēkabu Cilinski. Vecākā meita Kristīne precējusies ar Vanki Teodoru dzīvo Rozulas Strēlniekos. Viņiem divi dēli Arturs un Viktors, kurš studējis par ārstu. Otra Cilinsku meita Emma dzīvo Rīgā Apguldes ielā savā mājā, precējusies Antonu Zalcmani: tramvajnieku. Viņiem ir dēls Jānis. Cilinsku dēls Viktors izstudēja par ārstu, dzīvoja par ārstu Elejā, pēc tam Jelgavā kur apprecējās. Vācu okupācijas laikā bij sadarbojies ar vāciešiem, un aizgāja tiem līdzi uz Vāciju. Sievas tēvam bij divi dēli un trīs meitas no kurām viena Emma mirusi bērnībā. Vecākais dēls Jānis un meita Milda palika Ušās par saimniekiem pēc tēva nāves, katram pus māja. Jānis 1925. gada apprecēja Mildu Lozbergu. Viņiem ir divi dēli: Arnolds un Osvalds. Jānis mira 1954. g. janvārī. Otrs manas sievas brālis Kārlis bij drusku paskolots, strādājis kā darbvežu palīgs un kancelejas darbinieks, vēlāk bij grāmatu tirgotājs Limbažos. Apprecēja Limbažu namsaimnieka meitu Alisi Jēkabsons. Viņiem bij dēls Ludis, pazuda Lielajā Tēvijas karā vācu armijas rindās un meita Aija, kas strādā par skolotāju. Kārlis nomira jauns 1934. gada 25. sept. 36 gadu vecumā. Sievas māsa Milda dzimusi 1906. gadā, mantoja pusi no Ušu mājas, apprecējās ar Jāni Rozīti no Rozulas pagasta. Ir divi dēli: Ādolfs, dzimis 1933. gadā un Kārlis Juris, dzimis 1944. 4. novembrī."
1172937,"1943. gadā sniegs bij tik janvāra un februāra mēnešos, novembrī un decembrī silts. Vasara bij samērā vēsa, siena laiks lietains. Bij ilgi lietus periodi un tad atkal sausuma periodi. Āboliņš paauga ļoti labi. Rudzi cieta no pelējuma un mākslīgo mēslu trūkuma un raža bij diezgan maza ap 30 maisu. Kvieši un mieži labi. Auzas cieta no rūsas un bij vieglas. Kartupeļi labi auguši. Maigai bij laimīga aklās zarnas operācija – bij slimnīcā no 28. aprīļļa līdz 30. maijam. Mirdza pabeidza pamatskolu. Lidija gāja Umurgas lauksaimniecības skolā. Kara laikos sākās vāciešu atkāpšanās visās frontēs. Iesauca kara dienestā latviešu jaunekļus un vīrus no 1915.–
1924. g. dzimušus. Rudenī nodevu zirgu –
 balto Frici –
 gaļas normā, viņš bij slims ar ""baušlagu"" un nebij vairs darbā lietojams. 1944. gadā nebij nekāda lāga ziema, tik līdz pus janvārim, kad sniegs nokusa, tad atkal reizu reizēm uznāca, bet nekāda lāga braukšana nebij. Pavasaris arī nebij nekāds lietains un vēss –
 ievas ziedēja maija beigās. Vasara un rudens diezgan labi. Rudenī vācu karaspēks atkāpās un ienāca Sarkanā Armija. Septembra sākumā mums bij ierakumus taisīt Mazstraupes pagastā aiz Elles purva. Tur nostrādājām divas nedēļas: atkāpjoties vācieši tur nemaz neapmetās. Krievi ieveda atkal savu kārtību, dalīja zemi –
 šoreiz pa 15 hektāriem, bij jābrauc nebeidzamās šķūtīs un jādod dažādi produkti. Visus jaunākos vīriešus mobilizēja kara dienestam un vecākiem vīriešiem bij meža darbos un pie dzelzceļa būves. Es nostrādāju pa mežu no 1945. gada 6. februāra līdz 20. martam. Papriekš biju pie koku ciršanas un vēlāk pie izvešanas no Dikļu meža un Dikļu staciju."
1172924,"reizēm atkal pazaudēju. 18. jūlijā atkal aizgājām uz pozīcijām. Šoreiz bij pa kreisi no Jelgavas šosejas pie Misas upes. Vieta jauka, agrākais tīrums, priekšā pļava pa kuru līkumo Misas upes. Vācu pozīcijas 1600 soļu atstātu, aiz tām Olaines muižas drupas. Laiks karsts, ejam upē peldēties, vācieši šauj ar artilēriju, dažreiz jāpaķer drēbes un jāskrien uz ierakumiem paglābties no granātām. Vēlāk mums aizliedza iet peldēties, piedraudot ar nodošanu tiesai. Šeit mēs nostāvējām veselu mēnesi, vācieši gatavojās uzbrukumam un bieži apšaudīja mūsu pozīcijas, pie kam mums bija zaudējumi – dažus nosita un vairākus ievainoja. 19. augustā –
 1. septembrī pēc jaunā stila vācieši sāka savu uzbrukumu, atklājot artilērijas viesuļuguni pa kreisi no mums pie Ķekavas un Nāves salas (Nāves salu krievi jau pavasarī bij atdevuši vāciešiem) un pa labi Ložmetēju kalna. Pret mums lielgabalu uguns nebij visai spēcīga. 20. augusta rītā vāci nāca arī pret mums uzbrukumā, ko ar ložmetēju un flinšu uguni atsitām. Mēs izšāvām 12 ložmetēju lentes. Priecājāmies par uzvaru, te pulksten 9. rītā pienāk pavēle atkāpties –
 vācieši pie Nāves salas pārcēlušies pāri Daugavai un draud mūs atgriezt. Palēnām gājām atpakaļ, pie vakara bijām pie Torņakalna un vakarā un naktī izgājām cauri Rīgai gājām uz Ikšķiles pusi pretī vāciešiem. 21. augusta dienu pavadījām rezervē kaut kur pie Rotkaļa mājām, pie vakara priekšējie atkāpās, vācieši bij ielauzušies mums flangā, izcēlās panika, visi sāka bēgt atpakaļ. Jāsaka, ka karaspēks mums tur bij daudz, bet nebij vairs disciplīnas, neklausa virsniekiem un cīnīties ar vāciem nevienam nebij vairs patikas."
1172936,"vara, kas līdz pamatiem sagrozīja visu agrāko valsts iekārtu. Krietnu cilvēku vietā pie varas tika dažādi sliņķi un saules brāļi. Cenas precēm tik paaugstinātas un preces bij maz dabūjamas. Man pa ziemu ar veselību gāja diezgan grūti, bet vasarā varēju zemi apkopt. 1941. gads. Bij auksta, dziļa un gara ziema, vēl 19. aprīllī aizbraucu uz skolu ar ragavām. Pavasaris līdz pat Jāņiem bij vēss un sauss. Jūlijs, augusts un septembris bij karsti ar stipriem pērkoņu negaisiem. Rudens atkal sākās agri, jau 15. oktobrī bij ragavu ceļš. Jau novembrī sākās stiprs aukstums. Raža bij pavāja, graudi sīki un viegli. 22. jūnijā sākās karš starp Vāciju un Padomju Savienību, ko lielākā daļa latviešu ar nepacietību gaidīja. No kara mēs šeit Vainižos maz ko dabūjām redzēt, jo krievus drīz vien aiztrieca projām. 1942. gadā vācieši atkal ielauzās tālu Krievijā līdz Volgai un Kaukāzam, bet gada beigās atkal bij spiesti sākt atkāpšanos. Šis gads pagāja zem kara ietekmes – viss ir normēts, brīvā tirgū neko pirkt nedabū, bet slepenā maiņas tirdzniecībā vēl viss kas bij dabūjams. Pagājušā ziema bij stipri auksta, vairākas dienas sals bij pāri 30°
, un sniegs pastāvēja līdz pus aprīllim. Pavasaris bij vēss un sauss. Ievas sāka ziedēt 29. maijā un rudzi 27. jūnijā. Ap pusjūniju palika silts un lietains laiks tā kā labība un kartupeļi paauga apmierinoši, vienīgi siens un āboliņš iznāca pavisam maz. Aprīļļa sākumā es saslimu ar plaušu karsoni un nogulēju uz gultas 3 nedēļas, no tām 2 nedēļas slimnīcā un aprīļļa un maija mēnesī biju darba nespējīgs. Puisis –
 Alfreds Plotnieks –
 dzīvoja pie manis 1,5 mēnešus un apstrādāja laukus."
1172920,"tik ciešāk piespiežos pie zemes, lai lodes neķer muguru. Kad vācu atvairīšanas uguns palika lēnāka, sāka arī palikt gaišāks un bija jāmanās atpakaļ. Nolūkoju otru cini un ložmetēja uguns starpbrīdī aizlēcu aiz tā un tā tālāk, kamēr tiku tālāk nost no vācu ierakumiem. Atceļā palīdzēju iznestu kādu ievainoto. Daži strēlnieki bij nokavējuši atkāpšanos, palika gaišs un viņi nogulēja visu dienu aiz kāda aizsega kamēr vakarā tika atpakaļ. Kas bij stiprāk ievainoti tie turpat nobeidzās vaj kustoties vācieši viņus nošāva. Visu dienu pavadījām meža malā metrus 400 no vācu ierakumiem. No rīta sniegs bij mīksts, savārtījāmies slapji, dienu laiks noskaidrojās un palika auksts, tā ka bij liela salšana. Pret vakaru vāciešu izsūta no sāniem (flanga) un aizmugures uzbrūkošie strēlnieki, un mēs arī aizgājām uz šiem ierakumiem. Tie bij stipri izbūvēti, uz pazemes vietas uzmesti stāvi vaļņi, aplieti ar ūdeni un uzledojuši, tā ka pat bez vācu uguns tur būtu grūti iekļūt. Metās jau krēsla. Bija sācies vācu pretuzbrukums, šeit bij salasījušies daudz karavīru lielāko tiesu krievi, viņi klaiņoja pa vācu atstātām zemnīcām, dzēra tur atrasto degvīnu un virsnieki vairs nevarēja ievest nekādu kārtību, tā ka izredzes atsist vācu pretuzbrukumu bij mazas. Komandieris pavēlēja rotai un mūsu ložmetējam atiet uz savām pozīcijām un aizstāvēt tās pret varbūtējo vācu uzbrukumu. Aizgājām atpakaļ, uzstādījām ložmetēju vecajā vietā un dežūrējām pa nakti pie tā. Mūsu zemnīcai bij trāpījusi vācu granāta un izsitusi caurumu griestos. Pa nakti zemnīca bij pilna ar strēlniekiem, tā ka pat atsisties nebij iespē-"
1172927,"apstrādāt zemi. Valmierā abi ar Alfredu pieteicāmies un tikām iedalīti komendanta komandā. Valmierā mums klājās labi, katru pārdienu gan bija jāiet karaulā, bet tas nekas, ar to varēja apmierināties. 5. oktobrī arī brāli Arturu iesauca kara dienestā un viņš arī tika pie mums. 8. oktobrī sākās Bermonta uzbrukums Rīgai, tur bija vajadzīgi visi latviešu spēki. Noņēma no austrumu frontes ierindas pulkus un sūtīja pret vāciešiem. No Valmieras komendanta komandas izlasīja visus spējīgākos un aizsūtīja uz Latgali. Kādu laiku dzīvojām Vec-Gulbenes muižā, saformēja Latgales partizāņu pulka 4. bataljonu, kas sastāvēja no komendantu kareivjiem. Decembra sākumā mūs pārvietoja uz Latgali, gājām caur Balviem, Liepnu, Viļāniem. Stāvējām priekšējās līnijās kaut kur pie Beresku un Zēģeļu mājām. Tur jau nekādi ierakumi nebij. Dzīvojām pa sādžām un viensētām un priekšā izlikām posteņus. Pēc Bermontiešu izdzīšanas no Latvijas, mūsu karaspēku pārveda uz Latgali un 3. janv. iesākās mūsu uzbrukumus lieliniekiem. Līdz februāra beigām visa Latgale bij atbrīvota. Mūsu rotai arī iznāca piedalīties vairākās kaujās; gāja visādi: reizēm nebij nekāda panākuma un reizēm aizdzinām sarkanos krietni atpakaļ. Mēs visi trīs brāļi bijām kopā vienā nodaļā. Arturs 1920. gada pavasarī tika atvaļināts no dienesta un 1921. gada novembrī atkal no jauna iesaukts obligātā kara dienestā. 1920. gada pavasarī un vasarā vairs nekādu kauju nebija, reizēm gāja izlūkošanā un patramdīja sarkanos. 1920. gada Lieldienās mūsu rota gāja izlūkošanā, izdzina krievus no kādas sādžas un atņēma viņiem vienu ložmetēju. Šis ložmetējs kādu laiku"
1172925,"Atkāpjoties gāja dažādi, cits bija aizklīdis tāļu projām un tikai pēc ilgāka laika atkal salasījāmies kopā. No komandas daži bij pazuduši, vaj nu krituši gūstā vaj aizbēguši. Mūsu komanda dzīvoja pa Līgatni, stāvēja pozīcijās pie Siguldas un rezervē pie Nītaures. Pēc revolūcijas mūsu pulku aizsauca uz Cēsīm, kur mūsu ložm. vads dzīvoja Jaunā ielā 7 Fogeļa mājā, tur mums bija plašs, ērts dzīvoklis, bieži rīkojām ballītes. Es vairākas reizes aizgāju līdz mājām ciemā un pēc aizdara, jo ar pārtiku sāka iet vienmēr sliktāk. 11. (25.). janvārī mūsu pulks izbrauca no Cēsīm uz Donas apgabalu pret Kaļedina balto pulkiem. Braucām caur Ļeņingradu, Maskavu, Saratovu. Stacijā Nikitovka izkrāmējāmies no vagoniem un gājām kājām no sādžas uz sādžu, triekdami baltos projām. 10 (23.) februārī ieņēmām Rostovu un pēc dažām dienām gājām pāri Donai Kubanas apgabalā. Tur aizgājām diezgan tālu līdz stacijai Krilovskaja. Tad atbraucām atpakaļ Rostovā un no turienes pēc nedēļas izbraucām atpakaļ uz Maskavu. Tur notika pulka demobilizācija un jauna pulka formēšana. Izmaksāja labu tiesu naudas un deva ceļā līdz produktus, skatoties pēc vietas kur katrs bij uzdevis kurp brauks. Tā ka Latvija visa februāra beigās bij ieņemta no vāciešiem un pagaidām nebij izredzes tur iekļūt, tad lielākā daļa strēlnieku pierakstījās jaunajā pulkā. Tā ka man nebija kurp braukt un bij solīts ka pēc divu mēnešu nodienēšanas varēs atkal tikt no dienesta vaļā, tad arī es pierakstījos no jauna un paliku ložmetēju rotā. Drīz pēc tam daļu no pulka pārcēla uz Kalugu, tur bij nodedzināta liela artilērijas noliktava"
1172923,"strēlnieku pulka sapieru komandā. 31. martā (Lielā Piektdienā) izgājām no Rīgas uz pozīcijām. Šoreiz mums bij jāsargā ierakumi pie Ķekavas. Šeit mēs nostāvējām visu aprīļa mēnesi un tikai 3. maijā mūs nomainīja un mēs atnācām atkal uz Rīgu. Toreiz frontē bija brāļošanās laiks, reizēm mūsējie ar vācu kareivjiem sagājās un sarunājās. Virsnieki gan to negribēja pielaist. Šoreiz mūsu komanda apmetās Laboratorijas ielā 11. Mūsu ložmetējam istaba bija 5. stāvā, tā ka bij liela kāpelēšana pa trepēm. Visus 1. numurus paaugstināja par jefreitoriem un tā arī es dabūju vienu strīpu. 7.–14. maijā biju atvaļinājumā mājās. 30. maijā izgājām no Rīgas uz pozīcijām, šoreiz bij jāstāv pa labi no Olaines, sausā vietā un smilšu kalniņa. 31. maijā mūsu artilērija apšaudīja vāciešus, tie šāva pretī un mums nācās ciest cilvēku zaudējumus. Starp citu viena granāta sprāga mūsu zemnīcas priekšā caur vaļējām zemnīcas durvīm granātas šķembas nosita vienu rotas unteroficieri un kādu kareivi smagi ievainoja sānos. Es sēdēju pie zemnīcas lodziņa un lasīju grāmatu. Lodziņa stikli sabira man klēpī. Vācu pozīcijas bij vairāk kā versti tālu, laiks pastāvēja karsts, dienām un naktīm nodarbojāmies ar kāršu spēli, jo citādi bij nāvīgi garlaicīgi, nezinājām kā laiku pavadīt. 14. jūnijā 4. latviešu pulks mūs nomainīja un mēs atnācām uz Rīgu, 4. pulka telpās. Komanda šoreiz dzīvoja Marijas ielā 4, atkal piektajā stāvā. Pa Jāņiem tāpat uz ""zaķa"" aizbraucu uz mājām, kur nodzīvoju dažas dienas. Mācības mums vairs nav, pa dienām daudz brīva laika, apmeklējam kino vaj staigājam pa pilsētu. Daudz laika pavadām pie kāršu spēles, pa lielākai daļai spēlējam uz naudu. Es reizēm vinnēju"
1172931,"Mana sieva Karlīna dabūja pūrā līdz 3 gadu vecu ērzeli Frici, 3 govis, cūku, aitas un citu saimniecības inventāru. Man pašam bij zirgs Fricis, divas govis un cits inventārs, tā ka dzīvi uzsākām ar krietnu inventāru. Tomēr vēlāk nācās vēl ļoti daudz iegādāties dažāda lauksaimniecības inventāra. Dzīvē mēs vienmēr pamazām gājām uz augšu, iegādājāmies mašīnas, uzlaboju zemi, iegādājos šķirnes sēklas un t. t. Nekavējās ierasties arī jaunā audze. Pirmā meita – Lidija Skaidrīte piedzima sestdien 9. oktobrī 1926. gadā no rīta. Otra meita –
 Mirdza Leontīne piedzima otrdien 10. janvārī 1928. gadā no rīta. Trešā meita –
 Maiga Emīlija –
 piedzima piektdienas vakarā pirms Vasaras svētkiem 22. maija 1931. g. Nu beidzot gaidītais dēls –
 Ēvalds Ziedonis –
 piedzima svētdienas rītā 31. martā 1935. gadā. 1925. gada pavasaris bij agrs un silts, zemi varēja sākt agri strādāt. Raža laukos un pļavās izdevās laba. Šajā gadā piebūvējām kūts galā barības šķūni, dzīvojamai ēkai iemūrēja skursteni un rieres, ielika durvis un logus, ielika grīdas un griestus. 1925. g. 18. novmebrī abi ar Linu ienācām šeit dzīvot. Pirmo ziemu mums kalpone –
 Paulīne Kauliņa, kura vasarā bij par ganu Āžkalnos. 1926. gada pavasaris bij vēls, pie zemes strādāšanas tika vēlu un raža visiem bija diezgan vāja. Šajā vasarā neko nebūvēju. 1927. gada pavasarī sniegs gan nokusa agri, bet vēlāk bij stipri vēss un lietains laiks. 11. maijā pat uzkrita biezs sniegs. Raža arī nebij visai teicama. Šajā pavasarī uzbūvējām Mazlejas klēti ar vāguzi. Āžkalnos uzbūvējām labības šķūni ar riju. Šajā gadā bija Golveru Emma pie mums par kalponi."
1172933,"ļoti lielu plūdi ap 23. aprīlli. Pēc tam pieturējās silts laiks, zeme ātri nožuva un zemi varēja drīz sākt strādāt. Biezais sniegs bij izpūdējis rudzu un bij vispārēja rudzu neraža. Man uzauga ap 8 pūri no pūrvietas, bet dažiem bij pilnīgi jāizar laukā. Vasarājs izauga labs. Rudenī agri – sept. beigās –
 uznāca stiprs sals, kas apsaldēja virsējos kartupeļus, tā ka visi kartupeļi bij jāpārlasa. Šis gads bij tā saucamais ""krīzes gads"". Sviesta un gaļas cenas nokritās uz pusi, tā ka visiem zemniekiem bij liels naudas trūkums, īpaši lielākiem saimniekiem, kam algotie strādnieki. Šogad es aizvedu visvairāk piena –
 2422 kg piena no govs un pārdevu gaļā 10 cūkas. Šinī gadā uztaisīja tiltu un uzdambja ceļu pie strautiņa pāri Braslai, tā kā vairs nav jābaidās, kā plūdu laikā pārbraukt. 1932. gadā ziemā sniega bij maz, pavasaris diezgan agrs, siena laiks sauss, raža vidējā. Rudenī nopirku no Klētnieka kumeļu Ernu. 1933. gads bij samērā sauss, pavasarī sniegs nokusa agri, bet pavasaris bij visai sauss. Arī jūnijs un jūlijs bij sausi, āboliņš un vasarājs īsiņi. Rudzi un kartupeļi labi. Šajā gadā es uzbūvēju pirti-kalti un Āžkalnos uzbūvēja jauno dzīvojamo ēku. 1934. gada ziema bija ar daudziem atkušņiem un sniega nebij daudz. Sniegs nokusa agri. 1. maijā bij +27°
 C silts un 4. maijā jau ziedēja ievas un 10. maijā jau ziedēja ābeles un ceriņi, 8. jūnijā ziedēja rudzi. Jūnijs bij vēsāks par maiju un 18. jūnijā bij salna, kas apsaldēja kartupeļu lakstus. Siena laiks un tāpat rudzu laiks bij lietaini. Septembra 3 nedēļas bij ļoti siltas un sausas Rudzus šogad pirmo reizi iekuļu pāri par 100 pūriem. Ražas arī labas, kartupeļi auguša vidēji un bij ļoti miltaini. Āboliņš un siens vāji,"
1172939,"baltās puķes. Atāls neauga un zirgi un govis dzīvoja pusbadā. Labība bij vidēja, salmi bij īsi, bet graudi sausi un svarīgi. Kartupeļi maz un maziņi, no saknēm arī nav nekā. 1948. gadā bij silta ziema. Sniegs nokusa marta sākumā, vēl jau reizēm uznāca sniegs, bet atkal nokusa. Es sāku zemi strādāt 19. aprīllī. Sēšanu sāku 7. maijā un drīz tiku ar sēšanu galā. Vasara bij izdevīga labības augšanai. Rudens arī bij labs un līdz Jaungadam sniega uz ilgāku laiku nebij. Raža paauga laba. Šajā gadā zemniekus spieda nodot agri pirms termiņa labību – kviešus un auzas –
 lika sadzīt vairākiem kaimiņiem kopā tik, cik vajadzēja, lai izpildītu norma un tad atkal brauca uz citu vietu. Pārējo labību varēja kult vēlāk. Tāpat kartupeļus steidzināja nodot, veda ar auto uz dobi. Lauksaimniecības nodoklis bij uzlikts ļoti augsts, tā: Vec-Dreimanim 20000 rubļu  un Liel-Ķītam 22000 rubļu, kas nevarēja maksāt, tiem aprakstīja mantu un dažus ielika cietumā. Mūsu partorgs kādā sapulcē izteicās, ka ""kulakus"" ielikšot kuverā un aizsūtīšot uz Sibīriju, žēlastības nebūšot. Meža kokmateriālus sacirtām jau novembra sākumā. Es ar Lidiju izcirtām 63 ciešmetru Ķirbižu mežā. Izvešanu sāka decembrī, bet nebij ziemas ceļu. Pāris reižu aizbrauca ar zirgu uz vešanu, bet sniegs atkal ātri nokusa un bij jābrauc mājās. Man bij jāizved 40 kub. metri, kurus izvedu nākošā gada febr. Bij jāizbraucas 6 reizes turp ar zirgu, pēdējo reizi vedu ar ratiem. 9. februārī nodega Vainižu pamatskola; pēc tam skola pārgāja uz pagastnamu un izpildu komiteju uz Kļaviņiem. 5–
7. martā mums izdeva padomju pases."
1172926,"un mums bij jāapsargā atlikušās noliktavas un jāpilda sardzes dienests. Jāsaka, ka tur bij ļoti laba dzīve, ēdināja labi un dienests nebij grūts. Dabūju sazināties ar tēva brāli Klāvu un Alfrēdu, kurš arī bij pie tā apmeties, uzsacīju dienestu un pēc divu mēnešu nokalpošanas Sarkanajā Armijā tiku atvaļināts un 2. (15.) jūlijā ierados pie viņiem Udochas dzirnavās Porchovas apriņķī. Tur nodzīvoju 3 mēnešus un tad ar bēgļu vilcienu pārbraucu pāri robežai Pleskavā, no kurienes pēc 10 dienu karantīnas iebraucām Valmierā. No Valmieras abi ar Alfrēdu sukojām kājām uz mājām un svētdien 14. (27.) oktobrī ieradāmies mājās. Gada beigās Sarkanā Armija sekojot atejošiem vāciešiem atkal ieņēma lielāko daļu Latvijas. 26. februārī bij iesaukšana un mani atkal noņēma Sarkanajā Armijā. Pāris nedēļas nostāvēju Rīgā kur mūs saformēja un apmācīja. Tiku atkal ložmetejniekos, 9. Padomju Latvijas strēlnieku pulkā. Šie trīs mēneši Sarkanarmijā bija visgrūtākie manā kara dienesta laikā. Slikti bij ar pārtiku izdeva ļoti maz, te viss bij izpostīts, paši pirkt neko nevarējām, bij jādzīvo pusbadā, tāpat ēkas šeit bija nopostītas, vairāk iznāca dzīvot skuju būdās . Tāpēc bijām priecīgi, kad 22. maijā vāci un Baloža brigāde sāka uzbrukumu, pārrāva sarkano fronti un ieņēma Rīgu. Mums bij jāmet liels līkums, kamēr pie Ķekavas tikām pāri Daugavai. Lielākā daļa mobilizētie karavīri izklīda un steidzās uz savām mājām. Arī es laidu kājām vaļu un 26. maijā pārnācu mājās. Nebij lemts ilgi mājās dzīvot, 12. jūnijā mani un Alfredu atkal mobilizēja Limbažos Nacionālajā armijā. Arturs izgāja mācībā un viņš palika pagaidām mājās"
