File-ID,Transcribed Text
1231610,"Mana mate Anna Olsons dzimusi 20/IV 1845 g. miris 17/I 1918 g. 73 gadu vecuma apreceties 1867 g 22 gadu vecuma
Viņa lauliba ar man tevu dzimusi 4 bērni
Nils Svensons dzimusi 25/I 1870 g.
Karline Svensons "" 7/VIII 1876 g.
Matilda Svensons "" 6/X 1880 g.
Karlis Svensons "" 6/X 1884 g.
Mans tēvs nekādā skolā nav gajuši tikai pie vienu vecu zaldat trīs nedela, bet tam pasam neko nezina Ka viņš otram ko varēt mācit. Viņš tika bērniem varēt beidīt sist un no macišana nekas lielu neiznac. Tevs man teica ka viņš sed ar zaldatu cepuru galva, un uz kad viņš saskaitas viņs ņem sava cepure un svec tam virsu un saka lai atnestu viņš cepure un ka atnešu cepure ta viņšsarku sist ar lielu gāru mētu.
Tevs palieku nemacīts. Viņš strādājusi pie savam tēvām bet nekadu algu par to nesaņem jo no saimnieciba nekas neatlika unar liela grūtumu viņš tevs varu nomaksāt nomas naudu muiža. Ka tevs brālis un māzas uzauga lielu ta tevs bij jaiet no māja ara un pelņit arpuse maja. tamdel priekš visiem neiznāk maiz un apgerbu.
Tad tēvs aizgāja par puis pie viena saimniece kas bija atraitne un tur strādāja dažu gadu cik ilgi es to nezinu. Saimniece bija vienu uzaugusies meitene ar sarkanu mate, meitene iemīlejas mana tevu un bija arārtīgi lavelig pret viņu. Tēvs man stāstījā ka no sākuma viņa tik labi patikt, bet ka viņa pastavīgi ap viņš mīlināties tad viņš palēnīte iemīlijas viņa un bija žēlu skirties no viņa. Viņa māte laikam"
1231611,"nebija mēra ka viņa but appreceties ar vienu nabags puisite kas nav nekas. Ja tēvs vina apprecet tad viņš tulin tikt par saimnieks jo meita bija vieniga mantinieka. Ka bij nebij tevs no turens aizgaja. Es sasīja uz tevu labu ka tu viņa neprecetu, jo tad mēs visi but ar sarkanu mate un ta būtu arkārtīg nejauki. Tevs man ari stastju vienu interesanti notikums, ko viņš pie saimniece piedzīvojā. Saimniece bija stipri izredzīgs un vienu reiz tev sedeja istaba, saimniece nāk no keki istaba ieksa uz galda staveja vienu krusite ar kremu, bet saimniece to pārskatīja par kaķite un nāk istaba ieksa teica: kaķis vai tu iet no galda nost es tev palukošu sēdēt uz galda un ar rokam sit Krusite ka tas no galda uz grida krita sasitas pusu un visu kremu plaš pa grīdu. Saimniece bija ta pārsteigt ka nezinu ko lai darīt nosarkst no kauna un izskreja ara, Bet tev viņs no smekla nevareja tureties un pagāja labu laiku iekam saimniece tēvam drīkstēja rādīties.
Tevs nolīga pie vienu tirgotaji par perišu. Viņs bija galvena nodārbošana ar mantu vešanu no pilseta. Viņš man stastija vienu interesant notikum ko viņš piedzīvoja. Viņš stāsta: ""Ka es braucu uz māja ar mantam bija stipri tumš un miglain laiku un lietus list unka es ebrauc meža ieksa uz reis man apaks vagiem sāk gaisma spīdēt es skatīju kas ta var but ka apaks vāge sāku spīdet un vages būmi apaksa. Es palieku bail un domaju tas ir spoki un sāku trekt zirgus cik jauda un domaju ka es caur to no spokiem"
